<?xml version="1.0"?>
<Component
  xsi:noNamespaceSchemaLocation="Component.xsd"
  xmlns:xsi="http://www.w3.org/2001/XMLSchema-instance"
  library="IHP 130 BiCMOS components" names="cap_rfcmim" schematic_id = "C">
    <Description>
        SG13G2 RFMiM capacitor
    </Description>
    <Models>
            <DefaultModel value="C_IHP">
            </DefaultModel>
            <SpiceModel value="cmim">
            </SpiceModel>
    </Models>
    <Netlists>
        <NgspiceNetlist value=
            "{{{Letter}}}::schematic_id='nequal'C{PartCounter} {nets} {bulk} {{{model}}}::model='nonempty'
            {{w={w}}}::w='nonempty' {{l={l}}}::l='nonempty' wfeed={wfeed} ">
        </NgspiceNetlist>
        <CDLNetlist value="{NgspiceNetlist}"></CDLNetlist>
    </Netlists>
    <Symbols>
        <Symbol id="Standard">
            <File>{QUCS_S_COMPONENTS_LIBRARY}/Capacitor.sym</File>
        </Symbol>
    </Symbols>
    <Parameters>
        <Parameter name="model" unit="" default_value="cap_rfcmim" show="true">
            <Description>Model name</Description>
        </Parameter>
        <Parameter name="Letter" unit="" default_value="X" show="false">
            <Description>Spice prefix</Description>
        </Parameter>
        <Parameter name="w" unit="u" default_value="10.0" show="true">
            <Description>Width</Description>
        </Parameter>
        <Parameter name="l" unit="u" default_value="10.0" show="true">
            <Description>Length</Description>
        </Parameter>
        <Parameter name="bulk" unit="" default_value="sub!" show="false">
            <Description>Third terminal net name</Description>
        </Parameter>
        <Parameter name="wfeed" unit="um" default_value="5.0" show="true">
            <Description>Feed line length</Description>
        </Parameter>
        <Parameter name="C" unit="F" equation="m*((w*l*1.e-3) + 2*(w+l)*40e-12)" show="true">
            <Description>Capacitance value</Description>
        </Parameter>
    </Parameters>
</Component>
