<?xml version="1.0"?>
<Component
  xsi:noNamespaceSchemaLocation="Component.xsd"
  xmlns:xsi="http://www.w3.org/2001/XMLSchema-instance"
  library="IHP 130 BiCMOS components" names="pnpMPA" schematic_id = "Q">
    <Description>
        SG13G2 pnpMPA
    </Description>
    <Models>
        <DefaultModel value="BJT_IHP">
        </DefaultModel>
        <SpiceModel value="pnpMPA">
        </SpiceModel>
    </Models>
    <Netlists>
        <NgspiceNetlist value=
            "{{{Letter}}}::schematic_id='nequal'Q{PartCounter} {nets} {{{model}}}::model='nonempty'
            {{A={A}}}::A='nonempty' {{P={P}}}::P='nonempty'">
        </NgspiceNetlist>
        <CDLNetlist value="{NgspiceNetlist}"></CDLNetlist>
    </Netlists>
    <Symbols>
        <Symbol id="Standard">
           <File>{QUCS_S_COMPONENTS_LIBRARY}/pnpMPA.sym</File>
        </Symbol>
    </Symbols>
    <Parameters>
        <Parameter name="model" unit="" default_value="pnpMPA" show="true">
            <Description>Model name</Description>
        </Parameter>
        <Parameter name="Letter" unit="" default_value="X" show="false">
            <Description>Spice prefix</Description>
        </Parameter>
        <Parameter name="w" unit="u" default_value="1.0" show="true">
            <Description>Width</Description>
        </Parameter>
        <Parameter name="l" unit="u" default_value="2.0" show="true">
            <Description>Length</Description>
        </Parameter>
        <Parameter name="A" unit="" equation="w*l" show="false">
            <Description>Area</Description>
        </Parameter>
        <Parameter name="P" unit="" equation="2*(w+l)" show="false">
            <Description>Perimeter</Description>
        </Parameter>
        <Parameter name="m" unit="" default_value="1" show="false">
            <Description>Multiplier</Description>
        </Parameter>
    </Parameters>
</Component>
