<?xml version="1.0"?>
<Component
  xsi:noNamespaceSchemaLocation="Component.xsd"
  xmlns:xsi="http://www.w3.org/2001/XMLSchema-instance"
  library="IHP 130 BiCMOS components" names="C" schematic_id = "cmim">
    <Description>
        SG13G2 MiM capacitor
    </Description>
    <Models>
            <DefaultModel value="cmim">
            </DefaultModel>
            <SpiceModel value="cmim">
            </SpiceModel>
    </Models>
    <Netlists>
            <NgspiceNetlist value ="">
                    <Include value="">
                    </Include>
            </NgspiceNetlist>
    </Netlists>
    <Symbols>
        <Symbol id="Standard">
           <File>{QUCS_S_COMPONENTS_LIBRARY}/Capacitor.sym</File>
        </Symbol>
    </Symbols>
    <Parameters>
        <Parameter name="w" unit="um" default_value="10.0" show="true">
            <Description>Width</Description>
        </Parameter>
        <Parameter name="l" unit="um" default_value="10.0" show="true">
            <Description>Length</Description>
        </Parameter>
        <Parameter name="m" unit="" default_value="1" show="true">
            <Description>multiplier</Description>
        </Parameter>
    </Parameters>
</Component>
