<?xml version="1.0"?>
<Component
  xsi:noNamespaceSchemaLocation="Component.xsd"
  xmlns:xsi="http://www.w3.org/2001/XMLSchema-instance"
  library="IHP 130 BiCMOS components" names="dantenna" schematic_id = "D">
    <Description>
        SG13G2 isolation box 
    </Description>
    <Models>
        <DefaultModel value="isolbox">
        </DefaultModel>
        <SpiceModel value="D">
        </SpiceModel>
    </Models>
    <Netlists>
        <NgspiceNetlist value = "{{{Letter}}}::schematic_id='nequal'D{PartCounter} {nets} {model} {{w={w}}}::w='nonempty' {{l={l}}}::l='nonempty'"> </NgspiceNetlist>
        <CDLNetlist value = "{NgspiceNetlist}"> </CDLNetlist>
    </Netlists>
    <Symbols>
        <Symbol id="Standard">
           <File>{QUCS_S_COMPONENTS_LIBRARY}/IsolBox.sym</File>
        </Symbol>
    </Symbols>
    <Parameters>
        <Parameter name="model" unit="" default_value="dantenna" show="true">
            <Description>Modelname</Description>
        </Parameter>
        <Parameter name="Letter" unit="" default_value="X" show="false">
            <Description>Spice prefix</Description>
        </Parameter>
        <Parameter name="w" unit="u" default_value="3.0" show="true">
            <Description>Width</Description>
        </Parameter>
        <Parameter name="l" unit="u" default_value="3.0" show="true">
            <Description>Length</Description>
        </Parameter>
    </Parameters>
</Component>
